{
  "$schema": "https://json-schema.org/draft/2020-12/schema",
  "$comment": "Canonical result UTF-8 JSON is limited to 65536 bytes by mandatory validate_schema_message runtime validation; JSON Schema cannot express aggregate encoded-byte size.",
  "type": "object",
  "additionalProperties": false,
  "required": ["schema_version", "job_id", "operation_id", "attempt", "fence", "node_id", "deadline", "state", "result"],
  "properties": {
    "schema_version": {"const": 1},
    "job_id": {"type": "string", "format": "uuid"},
    "operation_id": {"type": "string", "format": "uuid"},
    "attempt": {"type": "integer", "minimum": 1},
    "fence": {"type": "string", "format": "uuid"},
    "node_id": {"type": "string", "pattern": "^spk_[0-9a-f]{32}$"},
    "deadline": {"type": "string", "format": "date-time", "pattern": "(?:Z|\\+00:00)$"},
    "state": {"enum": ["succeeded", "failed", "waiting-for-operator"]},
    "result": {"$ref": "#/$defs/safe-object"}
  },
  "$defs": {
    "safe-object": {
      "type": "object",
      "propertyNames": {"not": {"pattern": "[Pp][Aa][Ss][Ss][Ww][Oo][Rr][Dd]|[Ss][Ee][Cc][Rr][Ee][Tt]|[Tt][Oo][Kk][Ee][Nn]|[Aa][Uu][Tt][Hh][Oo][Rr][Ii][Zz][Aa][Tt][Ii][Oo][Nn]|[Pp][Rr][Ii][Vv][Aa][Tt][Ee].?[Kk][Ee][Yy]|[Cc][Oo][Mm][Mm][Aa][Nn][Dd]|[Ss][Hh][Ee][Ll][Ll]|[Ee][Nn][Vv][Ii][Rr][Oo][Nn][Mm][Ee][Nn][Tt]|(?:^|[_-])(?:[Pp][Aa][Tt][Hh]|[Ff][Ii][Ll][Ee]|[Ff][Ii][Ll][Ee][Nn][Aa][Mm][Ee]|[Dd][Ii][Rr][Ee][Cc][Tt][Oo][Rr][Yy]|[Ff][Ii][Ll][Ee][Ss][Yy][Ss][Tt][Ee][Mm]|[Mm][Oo][Uu][Nn][Tt])(?:$|[_-])|[a-z0-9](?:P[Aa][Tt][Hh]|F[Ii][Ll][Ee]|F[Ii][Ll][Ee][Nn][Aa][Mm][Ee]|D[Ii][Rr][Ee][Cc][Tt][Oo][Rr][Yy]|F[Ii][Ll][Ee][Ss][Yy][Ss][Tt][Ee][Mm]|M[Oo][Uu][Nn][Tt])$"}},
      "additionalProperties": {"$ref": "#/$defs/safe-value"}
    },
    "safe-value": {
      "anyOf": [
        {"type": ["null", "boolean", "number"]},
        {"type": "string", "not": {"pattern": "[/\\\\]"}},
        {"type": "array", "items": {"$ref": "#/$defs/safe-value"}},
        {"$ref": "#/$defs/safe-object"}
      ]
    }
  }
}
