{"attempt":1,"deadline":"2026-08-07T12:05:00+00:00","fence":"00000000-0000-4000-8000-000000000003","job_id":"00000000-0000-4000-8000-000000000001","node_id":"spk_00000000000000000000000000000001","operation_id":"00000000-0000-4000-8000-000000000002","result":{"evidence":{"installed_bytes":66000000000}},"schema_version":1,"state":"succeeded"}
